{
  "schemaVersion": "1.0.0",
  "bankId": "cordoba-capital-b1",
  "title": "Córdoba Capital: práctica B1 para autos",
  "coverage": "Práctica para autos en la ciudad de Córdoba. No aplica a toda la provincia ni es un examen oficial.",
  "questions": [
    {
      "id": "cordoba-capital-b1-001",
      "jurisdictionId": "ar-x-cordoba-capital",
      "licenseClasses": [
        "B1"
      ],
      "topic": "semaforos",
      "prompt": "En Córdoba Capital llegás a una intersección con luz amarilla intermitente. ¿Cómo debés cruzarla?",
      "options": [
        {
          "id": "cordoba-capital-b1-001-o1",
          "text": "A mínima velocidad y con máxima precaución."
        },
        {
          "id": "cordoba-capital-b1-001-o2",
          "text": "Sin reducir la marcha porque tenés prioridad."
        },
        {
          "id": "cordoba-capital-b1-001-o3",
          "text": "Con las balizas encendidas y acelerando."
        }
      ],
      "correctOptionId": "cordoba-capital-b1-001-o1",
      "explanation": "La ordenanza municipal usa esa señal para advertir cruces riesgosos y exige extrema precaución al atravesarlos.",
      "imageId": "semaforo-amarillo-intermitente",
      "sources": [
        {
          "sourceId": "cordoba-9981",
          "locator": "Art. 68 a.4; página física 40"
        }
      ],
      "contentStatus": "source-checked-draft",
      "sourceCheckedAt": "2026-10-20",
      "humanReviewedAt": null,
      "humanReviewer": null,
      "authorship": "original-editorial",
      "version": 1
    },
    {
      "id": "cordoba-capital-b1-002",
      "jurisdictionId": "ar-x-cordoba-capital",
      "licenseClasses": [
        "B1"
      ],
      "topic": "semaforos",
      "prompt": "Una luz roja intermitente regula un cruce en Córdoba Capital. ¿Qué debés hacer primero?",
      "options": [
        {
          "id": "cordoba-capital-b1-002-o1",
          "text": "Continuar si el vehículo de adelante ya cruzó."
        },
        {
          "id": "cordoba-capital-b1-002-o2",
          "text": "Detener completamente la marcha."
        },
        {
          "id": "cordoba-capital-b1-002-o3",
          "text": "Tocar bocina y avanzar despacio."
        }
      ],
      "correctOptionId": "cordoba-capital-b1-002-o2",
      "explanation": "Después de detenerte, solo podés reiniciar la marcha cuando observes que no existe riesgo. La luz no se interpreta como un simple aviso para bajar la velocidad.",
      "imageId": "semaforo-rojo-intermitente",
      "sources": [
        {
          "sourceId": "cordoba-9981",
          "locator": "Art. 68 a.5; página física 40"
        }
      ],
      "contentStatus": "source-checked-draft",
      "sourceCheckedAt": "2026-10-20",
      "humanReviewedAt": null,
      "humanReviewer": null,
      "authorship": "original-editorial",
      "version": 1
    },
    {
      "id": "cordoba-capital-b1-003",
      "jurisdictionId": "ar-x-cordoba-capital",
      "licenseClasses": [
        "B1"
      ],
      "topic": "semaforos",
      "prompt": "El semáforo está en rojo en Córdoba Capital. Hay una línea de detención pintada antes de la senda. ¿Dónde corresponde parar?",
      "options": [
        {
          "id": "cordoba-capital-b1-003-o1",
          "text": "Sobre la senda, para ver mejor el cruce."
        },
        {
          "id": "cordoba-capital-b1-003-o2",
          "text": "Después de la senda, sin entrar al carril transversal."
        },
        {
          "id": "cordoba-capital-b1-003-o3",
          "text": "Antes de la línea de detención."
        }
      ],
      "correctOptionId": "cordoba-capital-b1-003-o3",
      "explanation": "La línea fija el lugar previo al cruce donde debe quedar detenido el vehículo. Debés mantener libres la senda y las zonas de detención que correspondan.",
      "imageId": "semaforo-rojo",
      "sources": [
        {
          "sourceId": "cordoba-9981",
          "locator": "Art. 68 a.2; página física 40"
        }
      ],
      "contentStatus": "source-checked-draft",
      "sourceCheckedAt": "2026-10-20",
      "humanReviewedAt": null,
      "humanReviewer": null,
      "authorship": "original-editorial",
      "version": 1
    },
    {
      "id": "cordoba-capital-b1-004",
      "jurisdictionId": "ar-x-cordoba-capital",
      "licenseClasses": [
        "B1"
      ],
      "topic": "prioridades",
      "prompt": "Estás por ingresar a una rotonda en Córdoba Capital. Un auto ya circula alrededor de la zona central. ¿Qué debés hacer?",
      "options": [
        {
          "id": "cordoba-capital-b1-004-o1",
          "text": "Cederle el paso al auto que ya circula por la rotonda."
        },
        {
          "id": "cordoba-capital-b1-004-o2",
          "text": "Ingresar porque el que entra tiene prioridad."
        },
        {
          "id": "cordoba-capital-b1-004-o3",
          "text": "Obligarlo a frenar con una señal de luces."
        }
      ],
      "correctOptionId": "cordoba-capital-b1-004-o1",
      "explanation": "La ordenanza da prioridad al que circula alrededor de la zona central frente al que ingresa. También establece prioridad para quien egresa respecto de quien continúa girando.",
      "imageId": null,
      "sources": [
        {
          "sourceId": "cordoba-9981",
          "locator": "Art. 66; página física 40"
        }
      ],
      "contentStatus": "source-checked-draft",
      "sourceCheckedAt": "2026-10-20",
      "humanReviewedAt": null,
      "humanReviewer": null,
      "authorship": "original-editorial",
      "version": 1
    },
    {
      "id": "cordoba-capital-b1-005",
      "jurisdictionId": "ar-x-cordoba-capital",
      "licenseClasses": [
        "B1"
      ],
      "topic": "peatones",
      "prompt": "Un peatón ya comenzó a cruzar por la senda en una esquina sin semáforo de Córdoba Capital. ¿Cómo debés actuar?",
      "options": [
        {
          "id": "cordoba-capital-b1-005-o1",
          "text": "Pasar delante de él si calculás que hay espacio."
        },
        {
          "id": "cordoba-capital-b1-005-o2",
          "text": "Cederle el paso y detenerte si hace falta para que cruce normalmente."
        },
        {
          "id": "cordoba-capital-b1-005-o3",
          "text": "Tocar bocina para que espere en medio del cruce."
        }
      ],
      "correctOptionId": "cordoba-capital-b1-005-o2",
      "explanation": "En una encrucijada no semaforizada, el conductor debe permitir que el peatón que inició el cruce por la senda lo complete sin molestias.",
      "imageId": null,
      "sources": [
        {
          "sourceId": "cordoba-9981",
          "locator": "Art. 64; página física 39"
        }
      ],
      "contentStatus": "source-checked-draft",
      "sourceCheckedAt": "2026-10-20",
      "humanReviewedAt": null,
      "humanReviewer": null,
      "authorship": "original-editorial",
      "version": 1
    },
    {
      "id": "cordoba-capital-b1-006",
      "jurisdictionId": "ar-x-cordoba-capital",
      "licenseClasses": [
        "B1"
      ],
      "topic": "senalizacion",
      "prompt": "En Córdoba Capital te encontrás con la señal de la imagen. ¿Qué acción exige antes de continuar?",
      "options": [
        {
          "id": "cordoba-capital-b1-006-o1",
          "text": "Solo bajar la velocidad si ves otro auto."
        },
        {
          "id": "cordoba-capital-b1-006-o2",
          "text": "Mantener la marcha si el cruce parece libre."
        },
        {
          "id": "cordoba-capital-b1-006-o3",
          "text": "Detener totalmente el vehículo."
        }
      ],
      "correctOptionId": "cordoba-capital-b1-006-o3",
      "explanation": "PARE exige una detención completa. Ver la calle despejada no elimina esa obligación.",
      "imageId": "pare",
      "sources": [
        {
          "sourceId": "cordoba-guia",
          "locator": "Página física 13, señales PARE y CEDA EL PASO"
        }
      ],
      "contentStatus": "source-checked-draft",
      "sourceCheckedAt": "2026-10-20",
      "humanReviewedAt": null,
      "humanReviewer": null,
      "authorship": "original-editorial",
      "version": 1
    },
    {
      "id": "cordoba-capital-b1-007",
      "jurisdictionId": "ar-x-cordoba-capital",
      "licenseClasses": [
        "B1"
      ],
      "topic": "senalizacion",
      "prompt": "¿Qué obligación expresa esta señal triangular invertida?",
      "options": [
        {
          "id": "cordoba-capital-b1-007-o1",
          "text": "Ceder el paso."
        },
        {
          "id": "cordoba-capital-b1-007-o2",
          "text": "Detenerse obligatoriamente en todos los casos."
        },
        {
          "id": "cordoba-capital-b1-007-o3",
          "text": "Circular a una velocidad mínima."
        }
      ],
      "correctOptionId": "cordoba-capital-b1-007-o1",
      "explanation": "CEDA EL PASO obliga a respetar la prioridad del otro tránsito. Puede requerir detenerse para cumplirla, pero no equivale a PARE.",
      "imageId": "ceda-el-paso",
      "sources": [
        {
          "sourceId": "cordoba-guia",
          "locator": "Página física 13, señales PARE y CEDA EL PASO"
        }
      ],
      "contentStatus": "source-checked-draft",
      "sourceCheckedAt": "2026-10-20",
      "humanReviewedAt": null,
      "humanReviewer": null,
      "authorship": "original-editorial",
      "version": 1
    },
    {
      "id": "cordoba-capital-b1-008",
      "jurisdictionId": "ar-x-cordoba-capital",
      "licenseClasses": [
        "B1"
      ],
      "topic": "senalizacion",
      "prompt": "Ves esta señal circular con el número 40. ¿Qué indica?",
      "options": [
        {
          "id": "cordoba-capital-b1-008-o1",
          "text": "Una velocidad mínima de 40 km/h."
        },
        {
          "id": "cordoba-capital-b1-008-o2",
          "text": "Una velocidad máxima de 40 km/h."
        },
        {
          "id": "cordoba-capital-b1-008-o3",